{
  "schema_version": "0.1.0",
  "assessment_id": "eva-synthetic-001",
  "energy_audit_id": "era-synthetic-001",
  "recommended_verification_status": "field_tested",
  "islanding_gate_passed": true,
  "black_start_gate_passed": true,
  "critical_load_gate_passed": true,
  "storage_autonomy_days": 2,
  "minimum_demonstrated_continuity_days": 1,
  "renewable_sustaining_candidate": true,
  "backup_generation_candidate": false,
  "blockers": [],
  "as_of": "2026-08-31T00:00:00Z",
  "sensitivity": "public"
}
